question_id,name,description,answer,choices
0,Landmarks,Where is the statue of liberty located?,b,New Jersey|New York|Michigan|New Quay
1,Mountains,What is the highest mountain in the world?,d,Lhotse|Makalu|Broad Peak|Mount Everest
2,Landmarks,In which country is the Leaning Tower of Pisa located?,d,United Kingdom|United States|Germany|Italy
3,Landmarks,Where is the Eiffel Tower located?,c,Netherlands|France|Germany|Italy
4,Capital,What is the capital of Canada?,b,Vancouver|Ottawa|Montreal|Toronto
